Original,Character,Dialogue,Wordcount
STRAGO:What in blazes... What're you doing?,Strago,What in blazes... What're you doing?,6
"RELM:Grandpa. Who are these people? Friends? Can they use magic, too?",Relm,"Grandpa. Who are these people? Friends? Can they use magic, too?",11
STRAGO:Yaa! Hush!,Strago,Yaa! Hush!,2
RELM:What a cute doggy!,Relm,What a cute doggy!,4
SHADOW:Get away. He bites.,Shadow,Get away. He bites.,4
STRAGO:Go to your room!,Strago,Go to your room!,4
RELM:I will not! What a fussy old man!,Relm,I will not! What a fussy old man!,8
STRAGO:Please...leave us!,Strago,Please...leave us!,2
RELM:Well...all right...,Relm,Well...all right...,2
RELM:What a sweet puppy!,Relm,What a sweet puppy!,4
STRAGO:Hoo boy... Seems to like your dog...,Strago,Hoo boy... Seems to like your dog...,7
STRAGO:This is terrible...,Strago,This is terrible...,3
"SHADOW:No problem. The dog usually doesn't like people, though...",Shadow,"No problem. The dog usually doesn't like people, though...",9
STRAGO:Please excuse her. She's just young.,Strago,Please excuse her. She's just young.,6
STRAGO:This is just a back-water village. We can tell you nothing about your Espers...,Strago,This is just a back-water village. We can tell you nothing about your Espers...,14
LOCKE:I see... There's something wrong here...,Locke,I see... There's something wrong here...,6
TERRA:Let's have a look around.,Terra,Let's have a look around.,5
LOCKE:Thanks for your time!,Locke,Thanks for your time!,4
STRAGO:Sorry I couldn't have been more helpful!,Strago,Sorry I couldn't have been more helpful!,7
SHADOW:Interceptor! Come!,Shadow,Interceptor! Come!,2
"RELM:Oh, all right...",Relm,"Oh, all right...",3
STRAGO:This is awful! Relm...she's...,Strago,This is awful! Relm...she's...,4
TERRA:Relm's in danger?,Terra,Relm's in danger?,3
STRAGO:Yes! She was at a neighbor's house when a fire broke out. I won't be able to stand it if something happens to her!,Strago,Yes! She was at a neighbor's house when a fire broke out. I won't be able to stand it if something happens to her!,24
STRAGO:Please! Won't you help?!,Strago,Please! Won't you help?!,4
SHADOW:Interceptor... <D>Where are you?!,Shadow,Interceptor... <D>Where are you?!,4
STRAGO:Relm's inside that house!,Strago,Relm's inside that house!,4
LOCKE:What're you doing?,Locke,What're you doing?,3
MAYOR:Magic is forbidden!,Mayor,Magic is forbidden!,3
STRAGO:I don't care! Relm's inside!!!,Strago,I don't care! Relm's inside!!!,5
MAYOR:All right. We really have no choice.,Mayor,All right. We really have no choice.,7
MAYOR:Stand back.,Mayor,Stand back.,2
STRAGO:It's no use. The fire's too strong!,Strago,It's no use. The fire's too strong!,7
MAYOR:I think that's because they keep so many Fire Rods in here...,Mayor,I think that's because they keep so many Fire Rods in here...,12
STRAGO:I'm going in!,Strago,I'm going in!,3
TERRA:Wait...I'm going too.,Terra,Wait...I'm going too.,3
"LOCKE:Count me in. You'd better stay out here, gramps.",Locke,"Count me in. You'd better stay out here, gramps.",9
"STRAGO:Fool! I may be old, but I'm not powerless!",Strago,"Fool! I may be old, but I'm not powerless!",9
LOCKE:Try to avoid the flames.,Locke,Try to avoid the flames.,5
TERRA:Easier said than done.,Terra,Easier said than done.,4
STRAGO:Hurry! We have to find Relm!,Strago,Hurry! We have to find Relm!,6
STRAGO:Relm!!! Where are you?!,Strago,Relm!!! Where are you?!,4
SHADOW:Let's get outta here! <D>I'll use a Smoke Bomb!!,Shadow,Let's get outta here! <D>I'll use a Smoke Bomb!!,9
STRAGO:Are you okay?,Strago,Are you okay?,3
"RELM:Yes. Thanks, Grandpa!",Relm,"Yes. Thanks, Grandpa!",3
STRAGO:Save your thanks for these people.RELM:Thank you...,Strago,Save your thanks for these people. RELM Thank you...,7
STRAGO:I guess our town's little secret is out now...,Strago,I guess our town's little secret is out now...,9
LOCKE:Can everyone here use magic? What's going on here?,Locke,Can everyone here use magic? What's going on here?,9
STRAGO:This is......the village of the Mage Warriors...,Strago,This is......the village of the Mage Warriors...,7
STRAGO:Long ago humans used Magicite to gain magical powers. They came to be known as Mage Warriors.,Strago,Long ago humans used Magicite to gain magical powers. They came to be known as Mage Warriors.,17
LOCKE:But I thought they perished centuries ago...,Locke,But I thought they perished centuries ago...,7
"STRAGO:After the War of the Magi, the Espers fled to their new world behind the sealed gate. They wished to live peacefully, without fear of being used by humans. They left us here to fend for ourselves But we were despised by normal people. Everyone felt we had begun that war... They sent people to hunt us down like animals. There weren't even any trials...",Strago,"After the War of the Magi, the Espers fled to their new world behind the sealed gate. They wished to live peacefully, without fear of being used by humans. They left us here to fend for ourselves… But we were despised by normal people. Everyone felt we had begun that war... They sent people to hunt us down like animals. There weren't even any trials...",65
TERRA:Even though the only difference was that you could use magic...?,Terra,Even though the only difference was that you could use magic...?,11
"STRAGO:A few Mage Warriors escaped and found their way here. They were our ancestors. Our powers have weakened over time, but some of it remains.",Strago,"A few Mage Warriors escaped and found their way here. They were our ancestors. Our powers have weakened over time, but some of it remains.",25
"TERRA:Look, if you're up to it, we could use your help.",Terra,"Look, if you're up to it, we could use your help.",11
"STRAGO:So, you're after the Espers, eh...?",Strago,"So, you're after the Espers, eh...?",6
"STRAGO:Well, I owe you for saving Relm. I'll help you find your Espers.",Strago,"Well, I owe you for saving Relm. I'll help you find your Espers.",13
RELM:Me too!,Relm,Me too!,2
STRAGO:I don't think so.,Strago,I don't think so.,4
RELM:What a fuddy duddy...,Relm,What a fuddy duddy...,4
LOCKE:But...where do we start looking?,Locke,But...where do we start looking?,5
"STRAGO:Hmm...If they're here, they must be hiding in the mountains to the west.",Strago,"Hmm...If they're here, they must be hiding in the mountains to the west.",13
LOCKE:Why there?,Locke,Why there?,2
STRAGO:Those mountains have powerful magical properties. They say the Espers were created there...,Strago,Those mountains have powerful magical properties. They say the Espers were created there...,13
TERRA:Maybe they're drawn to that place?,Terra,Maybe they're drawn to that place?,6
LOCKE:I think it's worth a look.,Locke,I think it's worth a look.,6
SHADOW:Don't misunderstand me. I just wanted my dog back.,Shadow,Don't misunderstand me. I just wanted my dog back.,9
LOCKE:Going somewhere?,Locke,Going somewhere?,2
SHADOW:I'll search for the Espers in my own way.,Shadow,I'll search for the Espers in my own way.,9
SHADOW:Interceptor! Come!,Shadow,Interceptor! Come!,2
"STRAGO:I can't believe it... The Statues...!TERRA:""The"" Statues?!",Strago,"I can't believe it... The Statues...! TERRA ""The"" Statues?!",7
LOCKE:Some faint letters are carved on the back of the stone figures...,Locke,Some faint letters are carved on the back of the stone figures...,12
"LOCKE:Say, old man, what else can you tell us about these goddesses?",Locke,"Say, old man, what else can you tell us about these goddesses?",12
"STRAGO:They quite literally created magic, as we know it.",Strago,"They quite literally created magic, as we know it.",9
"LOCKE:So, they're the goddesses of magic, then?",Locke,"So, they're the goddesses of magic, then?",7
STRAGO:You could say that.,Strago,You could say that.,4
TERRA:I can feel their power...,Terra,I can feel their power...,5
"STRAGO:The Statues are the source of all magic. It's said the Espers made these images, and put them in a very special place. These represent power beyond all comprehension...",Strago,"The Statues are the source of all magic. It's said the Espers made these images, and put them in a very special place. These represent power beyond all comprehension...",29
TERRA:Our Espers no doubt came to this island to bask in all this magical power!,Terra,Our Espers no doubt came to this island to bask in all this magical power!,15
"LOCKE:Say, old timer, what happened to the stone goddesses?",Locke,"Say, old timer, what happened to the stone goddesses?",9
STRAGO:Legend has it that they're hidden somewhere beyond the reach of humans. I'd say they're beyond the sealed gate...,Strago,Legend has it that they're hidden somewhere beyond the reach of humans. I'd say they're beyond the sealed gate...,19
TERRA:I wonder if the barrier that protects that place is generated by those stone goddesses?,Terra,I wonder if the barrier that protects that place is generated by those stone goddesses?,15
LOCKE:Phew...what a story.,Locke,Phew...what a story.,3
"TERRA:If the Espers were attracted here by these statues, they must be around here somewhere!",Terra,"If the Espers were attracted here by these statues, they must be around here somewhere!",15
LOCKE:I think it's worth a look.,Locke,I think it's worth a look.,6
"ULTROS:G'heh, heh...these shiny statues are all mine! These'll get Ziegfried's attention!",Ultros,"G'heh, heh...these shiny statues are all mine! These'll get Ziegfried's attention!",11
ULTROS:Oh! They're glowing!! They're...beautiful!,Ultros,Oh! They're glowing!! They're...beautiful!,4
"LOCKE:Hey, squidball! Don't you ever learn?",Locke,"Hey, squidball! Don't you ever learn?",6
"ULTROS:Uh, well they always said I was a slow learner... but I eat FAST!!",Ultros,"Uh, well they always said I was a slow learner... but I eat FAST!!",14
RELM:Grandpa! I'm here......!,Relm,Grandpa! I'm here......!,3
STRAGO:Relm! I told you to stay at home!,Strago,Relm! I told you to stay at home!,8
RELM:I couldn't miss the chance to practice my drawing!,Relm,I couldn't miss the chance to practice my drawing!,9
ULTROS:How dare you! I'm Ultros!!,Ultros,How dare you! I'm Ultros!!,5
LOCKE:Relm and Ultros......What ARE you doing......?,Locke,Relm and Ultros......What ARE you doing......?,6
"RELM:Listen, Ulty...... Why don't you pose for me?",Relm,"Listen, Ulty...... Why don't you pose for me?",8
ULTROS:I'm not one of your kiddy friends! Don't talk to me as if I were!! I don't want a portrait!,Ultros,I'm not one of your kiddy friends! Don't talk to me as if I were!! I don't want a portrait!,20
RELM:Forget it! I don't wanna draw it anymore!,Relm,Forget it! I don't wanna draw it anymore!,8
RELM:It's okay......I'll just jump down from here.,Relm,It's okay......I'll just jump down from here.,7
TERRA:No!! You can't do that!!!,Terra,No!! You can't do that!!!,5
TERRA:How dare you bother that little girl! I'm not going to forgive you if you hurt her!!,Terra,How dare you bother that little girl! I'm not going to forgive you if you hurt her!!,17
"ULTROS:Well, whadduya want I should do?",Ultros,"Well, whadduya want I should do?",6
LOCKE:Ask her to draw your portrait. She may actually make you look pleasant!,Locke,Ask her to draw your portrait. She may actually make you look pleasant!,13
LOCKE:Don't be so heartless!,Locke,Don't be so heartless!,4
"ULTROS:........................................................................Oh, all right, Uncle Ulty REALLY wants you to do his portrait!!!",Ultros,".......................................................................Oh, all right, Uncle Ulty REALLY wants you to do his portrait!!!",12
"RELM:Hee, hee, hee... You're gonna love it!",Relm,"Hee, hee, hee... You're gonna love it!",7
"STRAGO:At any rate, come here!",Strago,"At any rate, come here!",5
RELM:Hey! Did you see me? I was awesome! Wouldn't I be more helpful than Gramps?,Relm,Hey! Did you see me? I was awesome! Wouldn't I be more helpful than Gramps?,15
TERRA:I suppose it wouldn't hurt to have you along...,Terra,I suppose it wouldn't hurt to have you along...,9
STRAGO:All right all ready! If you insist...,Strago,All right all ready! If you insist...,7
RELM:That's better!,Relm,That's better!,2
RELM:Are these...Espers?!,Relm,Are these...Espers?!,2
STRAGO:What about you?,Strago,What about you?,3
TERRA:I didn't think they'd look so...,Terra,I didn't think they'd look so...,6
"LOCKE:Gramps, take Relm and clear outta here!",Locke,"Gramps, take Relm and clear outta here!",7
RELM:What is it?,Relm,What is it?,3
STRAGO:I sense some immense magical power in Terra... It...frightens me...,Strago,I sense some immense magical power in Terra... It...frightens me...,10
LOCKE:I wonder if she's gonna go ballistic again?!,Locke,I wonder if she's gonna go ballistic again?!,8
YURA:You're somehow different... I sense a familiar power radiating from you...,Yura,You're somehow different... I sense a familiar power radiating from you...,11
STRAGO:You're the Espers that fled through the sealed gate?,Strago,You're the Espers that fled through the sealed gate?,9
"YURA:As a rule, we are not allowed to visit to your world. We few had gathered near the gate, and were wondering how we could save the Espers that had been kidnapped. It was just a coincidence that Terra appeared when she did...",Yura,"As a rule, we are not allowed to visit to your world. We few had gathered near the gate, and were wondering how we could save the Espers that had been kidnapped. It was just a coincidence that Terra appeared when she did...",43
TERRA:I felt...your presence...through the gate.,Terra,I felt...your presence...through the gate.,5
"YURA:We bolted the moment Terra opened the gate. But once in your world, we lost control of our powers.",Yura,"We bolted the moment Terra opened the gate. But once in your world, we lost control of our powers.",19
YURA:We completely leveled a city...and took some innocent lives...,Yura,We completely leveled a city...and took some innocent lives...,9
TERRA:That's what happened to me! I lost all control of my power...,Terra,That's what happened to me! I lost all control of my power...,12
STRAGO:There must be something in your world that allows you to focus your power differently. You must use caution while in our world...,Strago,There must be something in your world that allows you to focus your power differently. You must use caution while in our world...,23
YURA:We are deeply sorry to have caused you humans such suffering and pain.,Yura,We are deeply sorry to have caused you humans such suffering and pain.,13
LOCKE:The past is history. The Empire seems to want to talk peace with you. Why not come with us?,Locke,The past is history. The Empire seems to want to talk peace with you. Why not come with us?,19
YURA:They would forgive us so easily?,Yura,They would forgive us so easily?,6
LOCKE:Let's go to Thamasa and talk with General Leo.,Locke,Let's go to Thamasa and talk with General Leo.,9
LOCKE:General Leo.,Locke,General Leo.,2
LEO:Locke...you're back! And you've made the Espers understand our desire for peace!,Leo,Locke...you're back! And you've made the Espers understand our desire for peace!,12
"LEO:I am General Leo. May I have your name, please?",Leo,"I am General Leo. May I have your name, please?",10
YURA:I am called Yura.,Yura,I am called Yura.,4
"YURA:We have done something inexcusable to your people. This probably isn't the time or place to ask for your forgiveness, but...",Yura,"We have done something inexcusable to your people. This probably isn't the time or place to ask for your forgiveness, but...",21
LEO:Speak no further. It is we who owe you an apology. We hungered for your powerHow close we came to reenacting the War of the Magi!!!,Leo,Speak no further. It is we who owe you an apology. We hungered for your power…How close we came to reenacting the War of the Magi!!!,26
YURA:We must put this all behind us.,Yura,We must put this all behind us.,7
"LOCKE:I believe our job is finally over! I, for one, could use some peace and quiet...",Locke,"I believe our job is finally over! I, for one, could use some peace and quiet...",16
CELES:Let's return to Vector.,Celes,Let's return to Vector.,4
"CELES:Please, not another word.",Celes,"Please, not another word.",4
"RELM:I'm too hot, Grandpa.",Relm,"I'm too hot, Grandpa.",4
"KEFKA:Hee, hee...! How 'bout a little Magitek mayhem!",Kefka,"Hee, hee...! How 'bout a little Magitek mayhem!",8
LEO:Kefka! What ARE you doing?!,Leo,Kefka! What ARE you doing?!,5
"KEFKA:G'ha, ha, ha! Emperor's orders! I'm to bring the Magicite remains of these Espers to his excellency! Behold! A Magicite mother lode!!",Kefka,"G'ha, ha, ha! Emperor's orders! I'm to bring the Magicite remains of these Espers to his excellency! Behold! A Magicite mother lode!!",22
KEFKA:I don't care for the appearance of this pitiful little hamlet...So burn it!!,Kefka,I don't care for the appearance of this pitiful little hamlet...So burn it!!,13
LEO:Kefka! No!,Leo,Kefka! No!,2
KEFKA:Shut up!,Kefka,Shut up!,2
LEO:Kefka! Your behavior is dishonorable! I can't allow this!,Leo,Kefka! Your behavior is dishonorable! I can't allow this!,9
KEFKA:Ah......Leo......always the consummate soldier......,Kefka,Ah......Leo......always the consummate soldier......,4
"LEO:: Where are you, Kefka......Show yourself!!",Leo,"here are you, Kefka......Show yourself!!",6
KEFKA:EMPEROR GESTAHL......I need you here......,Kefka,EMPEROR GESTAHL......I need you here......,5
LEO:: My liege!,Leo,y liege!,3
"LEO:: But, Emperor...!",Leo,"ut, Emperor...!",3
GESTAHL:Don't say anything. I understand how you feel.,Gestahl,Don't say anything. I understand how you feel.,8
"KEFKA:Uwee, hee, hee......That's right! What we have to do now is to collect Magicite!",Kefka,"Uwee, hee, hee......That's right! What we have to do now is to collect Magicite!",14
LEO:: But my liege......what have I been fighting for...?,Leo,ut my liege......what have I been fighting for...?,9
"GESTAHL:Leo, I'd like you to take a nice, long snooze...! Very long! Uwa, ha!",Gestahl,"Leo, I'd like you to take a nice, long snooze...! Very long! Uwa, ha!",14
"KEFKA:So......you think you hit me?! That was simply my shadow! And how did you like my Gestahl? I should've been on the stage! Well, General......",Kefka,"So......you think you hit me?! That was simply my shadow! And how did you like my Gestahl? I should've been on the stage! Well, General......",25
"LEO:: Shut up, Kefka! I oughtta......",Leo,"hut up, Kefka! I oughtta......",6
"KEFKA:Oh! A threat...? You're such a violent little brute! I'll tell your ""liege"" I had to exterminate a traitor...!",Kefka,"Oh! A threat...? You're such a violent little brute! I'll tell your ""liege"" I had to exterminate a traitor...!",19
"KEFKA:Whoa! Yes, I feel some incredible magic power here, today! Wave after wave of pure, magical energy...",Kefka,"Whoa! Yes, I feel some incredible magic power here, today! Wave after wave of pure, magical energy...",17
"KEFKA:I'd say you're all charged up, boys and girls...or whatever...Say, remind me to show you my Magicite collection someday! You might see a few familiar faces!!!",Kefka,"I'd say you're all charged up, boys and girls...or whatever...Say, remind me to show you my Magicite collection someday! You might see a few familiar faces!!!",26
KEFKA:Now for a little Magicite hocus-pocus...!,Kefka,Now for a little Magicite hocus-pocus...!,6
"KEFKA:First, let's neutralize your abilities.",Kefka,"First, let's neutralize your abilities.",5
"KEFKA:Now, little Espers... Let's see whatcha got!",Kefka,"Now, little Espers... Let's see whatcha got!",7
KEFKA:Eh?! You wanna take me on? Fine. Here I am...,Kefka,Eh?! You wanna take me on? Fine. Here I am...,10
"KEFKA:Imagine! Thinking you could defeat ME!! This is rich! Mwa, ha, ha!",Kefka,"Imagine! Thinking you could defeat ME!! This is rich! Mwa, ha, ha!",12
"KEFKA:Now, my little Magicite pretties......come, and help me build the magical empire of ""Kefka""!",Kefka,"Now, my little Magicite pretties......come, and help me build the magical empire of ""Kefka""!",14
"KEFKA:G'haw, haw...... Ooh! They're warm to the touch! What treasures!",Kefka,"G'haw, haw...... Ooh! They're warm to the touch! What treasures!",10
KEFKA:This is ridiculous! I had no idea you were such wimps! Time to put a stop to all of this.,Kefka,This is ridiculous! I had no idea you were such wimps! Time to put a stop to all of this.,20
"KEFKA:Phew... I think I have plenty of Magicite for the time being... that is, until I make my way through your precious sealed gate!!",Kefka,"Phew... I think I have plenty of Magicite for the time being... that is, until I make my way through your precious sealed gate!!",24
KEFKA:I dont believe this!,Kefka,I don’t believe this!,4
TERRA:General Leo...,Terra,General Leo...,2
TERRA:People only seem to want power. Do they really want to be like me?,Terra,People only seem to want power. Do they really want to be like me?,14
TERRA:I...I wanted to learn so much more from you...,Terra,I...I wanted to learn so much more from you...,9
"LOCKE:We not only lost Leo, but Shadow, too... Curse the Empire!",Locke,"We not only lost Leo, but Shadow, too... Curse the Empire!",11
LOCKE:This'll have to do...,Locke,This'll have to do...,4
CELES:He was so gentle...,Celes,He was so gentle...,4
RELM:Ill go with you.,Relm,I’ll go with you.,4
LOCKE:Now I'm worried about Edgar and the others...,Locke,Now I'm worried about Edgar and the others...,8
TERRA:I wish I could say they were safe...,Terra,I wish I could say they were safe...,8
SETZER:We've been had!! The Emperor is a liar!,Setzer,We've been had!! The Emperor is a liar!,8
"CYAN:Thanks to Edgar, we escaped before anything bad happened...",Cyan,"Thanks to Edgar, we escaped before anything bad happened...",9
"LOCKE:Way to go, Edgar!",Locke,"Way to go, Edgar!",4
"EDGAR:I got to know the gal who brought us tea. After a while, she just blurted out the whole crooked plan.",Edgar,"I got to know the gal who brought us tea. After a while, she just blurted out the whole crooked plan.",21
"SABIN:So...you finally hit pay dirt, eh?",Sabin,"So...you finally hit pay dirt, eh?",6
EDGAR:Watch your mouth! There're ladies present! I was a perfect gentleman.,Edgar,Watch your mouth! There're ladies present! I was a perfect gentleman.,11
LOCKE:General Leo's gone...Kefka did him in...,Locke,General Leo's gone...Kefka did him in...,6
CYAN:Sir Leo?! Gone?! What a waste...He was their finest soldier...,Cyan,Sir Leo?! Gone?! What a waste...He was their finest soldier...,10
EDGAR:We need to rethink our plans. Let's return to the airship.,Edgar,We need to rethink our plans. Let's return to the airship.,11
STRAGO:May I accompany you?,Strago,May I accompany you?,4
EDGAR:Who're you?,Edgar,Who're you?,2
LOCKE:He's one of this town's citizens.,Locke,He's one of this town's citizens.,6
TERRA:He's descended from the Mage Warriors of yore... I think he can be a big help.,Terra,He's descended from the Mage Warriors of yore... I think he can be a big help.,16
STRAGO:We must expect the Empire to flex its new-found muscle soon.,Strago,We must expect the Empire to flex its new-found muscle soon.,11
"RELM:I'm coming along, too.",Relm,"I'm coming along, too.",4
"SABIN:Yeah, right kid!",Sabin,"Yeah, right kid!",3
"RELM:What? Who is this puffed up aerobics instructor, anyway?",Relm,"What? Who is this puffed up aerobics instructor, anyway?",9
SABIN:Kid's got quite a lip!,Sabin,Kid's got quite a lip!,5
RELM:Aaack! I'm gonna paint your portrait!,Relm,Aaack! I'm gonna paint your portrait!,6
STRAGO:All right all ready! If you insist...,Strago,All right all ready! If you insist...,7
RELM:That's better!,Relm,That's better!,2
SABIN:Lets go!,Sabin,Let’s go!,2
"RELM:What's wrong, lover boy?",Relm,"What's wrong, lover boy?",4
EDGAR:How old are you?,Edgar,How old are you?,4
"RELM:I'm coming along, too.",Relm,"I'm coming along, too.",4
"EDGAR:You've grown up entirely too fast! Lighten up, okay?!",Edgar,"You've grown up entirely too fast! Lighten up, okay?!",9
SETZER:The Empire's after the sealed gate! They're looking for some statues or something.,Setzer,The Empire's after the sealed gate! They're looking for some statues or something.,13
"GESTAHL:Oh, those silly Espers! To think they opened the gate themselves! The Statues should be just ahead. If we can just get our hands on them, we'll have everything we ever dreamed of!",Gestahl,"Oh, those silly Espers! To think they opened the gate themselves! The Statues should be just ahead. If we can just get our hands on them, we'll have everything we ever dreamed of!",33
GESTAHL:Come quickly!,Gestahl,Come quickly!,2
"CELES:What's wrong, Terra?",Celes,"What's wrong, Terra?",3
TERRA:The island... The world is groaning in pain...,Terra,The island... The world is groaning in pain...,8
"GESTAHL:Fuwa, ha, ha! Now THIS is power! This, and my Magicite... now nothing can stop me!",Gestahl,"Fuwa, ha, ha! Now THIS is power! This, and my Magicite... now nothing can stop me!",16
STRAGO:The beginning of all magic...,Strago,The beginning of all magic...,5
"STRAGO:It is said that they somehow neutralized each other's power, then sealed themselves away... the 3 statues should ever be moved out of alignment, the resulting inbalance of power would... ...rearrange the face of our planet...",Strago,"It is said that they somehow neutralized each other's power, then sealed themselves away... the 3 statues should ever be moved out of alignment, the resulting inbalance of power would... ...rearrange the face of our planet...",36
SETZER:Quick! Let's jump onto that thing!,Setzer,Quick! Let's jump onto that thing!,6
"SHADOW:Down with the Empire! Once I outlived my usefulness, they tried to off me!",Shadow,"Down with the Empire! Once I outlived my usefulness, they tried to off me!",14
SHADOW:Is Interceptor all right?,Shadow,Is Interceptor all right?,4
SHADOW:Forget about me.,Shadow,Forget about me.,3
SHADOW:I sold my skills to the Empire... I have no right to fight together with you.,Shadow,I sold my skills to the Empire... I have no right to fight together with you.,16
